{
  "apiVersion": "fabric.viewsense.io/v1alpha1",
  "kind": "Module",
  "metadata": {"name": "agents", "title": "Bounded agent runtime"},
  "spec": {
    "maturity": "implemented-reference",
    "implementationPaths": ["src/viewsense_agent_runtime/app.py"],
    "contractPaths": ["docs/design/high-level/70-agentic/01-agent-runtime-ingestion-workflows.md", "contracts/schemas/agent-run-v1.schema.json"],
    "helmPaths": ["products.agentRuntime", "modules.agent-runtime", "datastores.agent"],
    "dataOwnership": ["agent run checkpoints", "approval state", "ordered run events"],
    "providers": [
      {"name": "builtin", "status": "bundled"},
      {"name": "langgraph-compatible-external", "status": "planned"}
    ]
  }
}
